{
  "$schema": "./project-status.schema.json",
  "schemaVersion": "1",
  "updatedAt": "2026-09-13",
  "phase": "phase-1a-spike",
  "production": "no-go",
  "nextWorkItem": null,
  "implemented": [
    "strict-jsonc-parser-spike",
    "formal-v1-config-and-product-graph-schemas",
    "minimal-in-memory-web-server-product-graph-builder",
    "resolution-record-v1-contract-and-pure-normalization",
    "workspace-package-exports-and-relative-source-resolver",
    "target-boundary-and-dynamic-import-policy",
    "s2-native-tool-adapter-conformance-runner",
    "s2-macos-two-checkout-two-store-transcript",
    "s2-linux-macos-windows-conformance",
    "s3-canonical-js-bundle-trace-and-reconciliation",
    "s3-css-worker-wasm-asset-virtual-module-trace",
    "s3-linux-macos-windows-conformance",
    "executable-registry-v1-entry-core",
    "s4-deterministic-registry-runner",
    "s4-resolved-service-event-registry-reconciliation",
    "s4-guarded-entry-side-effect-probe",
    "s4-linux-macos-windows-conformance",
    "proposed-client-domain-ui-release-contract-fixtures",
    "s5-serial-lifecycle-and-resource-ledger-core",
    "s5-lifecycle-aware-event-dispatch-and-drain",
    "s5-linux-macos-windows-conformance",
    "s6-fastify-real-loopback-host-runner",
    "s6-bounded-timeout-and-local-posix-signal-evidence",
    "s6-linux-macos-windows-conformance",
    "s7-digest-pinned-postgresql-query-and-migration-conformance",
    "s8-serializable-contribution-compiler",
    "s8-local-dual-shell-browser-accessibility-and-visual-conformance",
    "s8-ubuntu-dual-shell-browser-accessibility-and-visual-conformance"
  ],
  "unavailable": [
    "product-scaffolder", "cli", "preset-expansion", "published-tool-resolver-adapter-api",
    "runtime-host", "web-app", "server-app",
    "database-kit", "identity-kit", "deployment", "desktop-client", "mobile-client"
  ],
  "spikes": {
    "s1": {
      "status": "provisional-pass",
      "evidence": ["node-24-tests", "vitest", "typescript", "ajv", "cross-directory-hash"],
      "nextGate": "Replace the spike parser with the selected production validator and run the required cross-platform matrix."
    },
    "s2": { "status": "pass", "evidence": ["resolution-matrix", "resolution-record-v1-normalization", "workspace-source-resolver", "target-and-dynamic-import-policy", "typescript-node-vite-vitest-native-reconciliation", "linux-macos-windows-two-checkout-two-store-conformance"], "nextGate": "Keep the frozen S2 corpus as a cross-platform regression gate while S3 consumes the canonical records." },
    "s3": { "status": "pass", "evidence": ["canonical-bundle-and-artifact-trace-schema", "vite-8.2.2-observation-runner", "two-checkout-two-store-determinism", "source-edge-bundle-module-reconciliation", "css-worker-wasm-asset-virtual-module-observation", "linux-macos-windows-conformance", "trace-855f208dd81cd0106e618cf6fc16aefc822afa084aaaf20bce355d6c06da0c14", "github-actions-34022590661"], "nextGate": "Keep the frozen S3 corpus as a cross-platform regression gate while S4 generates and reconciles Executable Registry records." },
    "s4": { "status": "pass", "evidence": ["executable-registry-v1-schema-and-types", "joint-graph-registry-assembly-id", "resolved-service-event-graph-bindings", "registry-binding-handler-reconciliation", "eighteen-mismatch-pre-factory-corpus", "guarded-generated-entry-fetch-probe", "two-working-directory-two-input-order-determinism", "linux-macos-windows-conformance", "assembly-ecb16708efa35789d3f9aa9ccf603b9c48348bd7c097ba315738a4a09f6c1ba5", "registry-155dfc7f1f9a7d4f76c1b4c02e32618df699161db9f4d56086a9b55e5e5d730b", "github-actions-34026361015"], "nextGate": "Keep the frozen S4 corpus as a cross-platform regression gate while S5 consumes explicit Graph and Registry records." },
    "s5": { "status": "pass", "evidence": ["serial-a-to-d-factory-start-stop", "single-ready-transition", "resource-ledger-and-partial-start-cleanup", "idempotent-and-concurrent-stop", "bounded-start-cancellation", "lifecycle-gated-event-publish", "stable-serial-handler-dispatch", "depth-first-correlation-causation", "depth-33-rejection", "active-dispatch-drain-before-stop", "linux-macos-windows-lifecycle-and-event-conformance", "github-actions-34043351874", "s6-bounded-shutdown-and-host-termination-conformance"], "nextGate": "Keep the frozen S5 lifecycle and Event corpora as cross-platform regression gates while S7 adds real Database resources." },
    "s6": { "status": "pass", "evidence": ["fastify-5.12.3-candidate-review", "node-24.20.0-fetch-undici-7.29.0", "ten-scenario-server-host-contract", "bounded-startup-shutdown-client-harness-deadlines", "posix-signal-and-windows-platform-distinction", "linux-macos-windows-matrix-cf82465d0667b1a58f46bbfa9c2aa65a3247cff53ac11e3d3fcf63590cdd78eb", "ubuntu-macos-real-sigterm-sigint-shared-stop", "windows-unsupported-by-node-signal-boundary", "timeout-report-before-nonzero-exit", "github-actions-34084714281"], "nextGate": "Keep the frozen S6 corpus as a cross-platform regression gate while S7 evaluates Database resources; production Runtime and Server adapter APIs remain unimplemented." },
    "s7": { "status": "pass", "evidence": ["postgresql-18.6-bookworm-index-sha256-1c59e2c3c818eaa0f0628f695b36e7c9e362d6b219b36a54a32df645cbd7e1af", "exact-pg-8.23.0-types-8.23.1-kysely-0.29.5-drizzle-0.45.2-lock", "direct-sql-common-driver-baseline", "neutral-two-owner-schema-and-seed", "fourteen-scenario-forward-reverse-query-migration-fault-conformance", "migration-owner-hash-lock-transaction-checkpoint-manual-removal-deadline-evidence", "linux-amd64-macos-arm64-matrix-8e48920e5c1adc8b9cf327ffeeb195dcc48d2c4c8290a7f0822cbf751313df04", "zero-runner-owned-resource-balance", "kysely-query-layer-selection", "github-actions-34192604333", "s2-s6-regressions-34192604170-34192604401", "spdx-and-slsa-attestation-metadata-with-signature-blocker"], "nextGate": "Keep the frozen S7 corpus as a digest-pinned Ubuntu regression gate; production Database adapter, backup/PITR, HA and business schemas remain unimplemented." },
    "s8": { "status": "pass", "evidence": ["react-19.2.8-react-router-8.3.1-data-mode", "react-aria-components-1.21.1", "playwright-1.63.0-browser-revisions-1243-1543-2359", "serializable-six-route-seven-navigation-four-command-contributions", "default-shell-and-workbench-shell", "three-browser-45-behavior-144-axe-20-chromium-visual", "previous-minor-compatible-and-public-override-manual-review", "ubuntu24-x64-matrix-be6a41b0fe50af9c9c1404bea20157d4c286977ec066b4e2dd63279d087d570c", "github-actions-capture-34253202827-artifact-10067015178"], "nextGate": "Keep the frozen S8 corpus as an Ubuntu regression gate; production UI packages and Product Shell APIs require a separately documented and authorized phase." },
    "cr1": { "status": "draft-matrix", "evidence": [], "nextGate": "Select the first additional client runtime." },
    "ds1": { "status": "draft-matrix", "evidence": [], "nextGate": "Select the first native renderer corpus." },
    "sc1": { "status": "draft-matrix", "evidence": ["proposed-release-contracts"], "nextGate": "Run against a real registry, signer and release runner." },
    "n1": { "status": "draft-matrix", "evidence": [], "nextGate": "Wait for a real native storage boundary." },
    "e1": { "status": "draft-matrix", "evidence": [], "nextGate": "Run a real editor adapter and second use case." },
    "y1": { "status": "draft-matrix", "evidence": [], "nextGate": "Run two data-domain codecs and fault transcripts." }
  }
}
